trending_date,normalized_title,summary,news_relation,search_relation
2025-10-14,2026 FIFA World Cup qualification (inter-confederation play-offs),The inter-confederation play-offs will decide two spots for the 2026 FIFA World Cup.,"Qualification is hitting a crescendo as many confederations just sealed direct berths and a few nations (including historic first‑timers) grabbed headlines. The inter‑confederation play‑offs now become the decisive, high‑stakes mini‑tournament that will hand out the final tickets to the expanded 48‑team finals. Readers are flocking to live trackers, match reports and draw details for last‑minute drama, national bragging rights and travel‑list panic.","A recent clarification of the six‑team inter‑confederation playoff format and its March 2026 mini‑tournament has driven renewed interest. CAF’s internal play‑off bracket and which African side could still reach the World Cup circulated widely on Reddit, Facebook and Instagram, pushing fans to the Wikipedia explainer. Coverage and breakdowns from outlets like ESPN and Goal have also prompted more searches. Supporters are already assigning lucky rituals to potential matchups."
2025-10-14,2026 FIFA World Cup qualification (AFC),The Asian qualification for the 2026 FIFA World Cup includes eight direct slots.,"Decisive AFC qualifying results and a fresh batch of teams clinching 2026 berths have pushed this topic higher in the news cycle. High‑stakes fixtures — notably Saudi Arabia vs Iraq and Indonesia’s dramatic matches — plus live blogs, updated qualification lists, and ticket/broadcast guides are driving clicks. Fans and media are trawling schedules, standings and practical info as the World Cup build‑up accelerates.","AFC fourth‑round World Cup qualifying matches were played this week, with decisive games (notably Qatar v UAE and Saudi Arabia’s win over Iraq) shaping which Asian teams reach or edge closer to 2026. FIFA, AFC and news outlets published live results and updated standings, sending fans to the Wikipedia pages for quick context and group tables. Drama on the pitch — late goals and qualification permutations — made the article an irresistible click for football followers."
2025-10-14,FBI Ten Most Wanted Fugitives,A list maintained by the FBI to promote the capture of dangerous fugitives.,"A newly released FBI Ten Most Wanted list includes several high-profile and shocking names. Media coverage singled out a former Canadian Olympic snowboarder now accused of drug trafficking and murder, which reads like a true-crime plot twist. Supplementary FBI notices — including a recent Mississippi mass shooting alert and historical retrospectives — gave outlets multiple timely angles to report. The combination of celebrity, violent crime allegations, and official federal action made the list headline-worthy.",Recent FBI activity — including a press release and the reported extradition of a Ten Most Wanted fugitive from Mexico — has renewed interest in the list. Viral social posts claiming former Olympic snowboarder Ryan Wedding was added (and political commentary about list updates) have amplified searches and confusion. People are checking the Wikipedia page for the latest official names and status.
2025-10-14,Gaza peace plan,A new peace plan for the Gaza war was announced by President Trump.,"Donald Trump publishing a full 20‑point Gaza peace plan, presented alongside Netanyahu, made it front‑page news. Reports that Israel and Hamas agreed to a “first phase” ceasefire and hostage releases amplified coverage. Experts rushed to produce guides, legal analyses, and critiques because the plan raises big questions about Palestinian governance and implementation. It reads like a 20‑point to‑do list for peace — if everyone agrees to read it.","President Trump signed and promoted a U.S.-brokered 20-point Gaza peace plan and ceasefire, prompting heavy news coverage. Reporters are parsing key provisions — demilitarization, no forced displacement, phased Israeli withdrawal — and whether Hamas will relinquish weapons and release hostages. Analysts warn implementation looks fraught as phase one shows signs of strain, so commentators are asking if the plan will hold or fold."
2025-10-14,One Battle After Another,A 2025 action thriller about an ex-revolutionary and his daughter pursued by a corrupt officer.,"A Variety report that the Paul Thomas Anderson film is now projected to lose roughly $100 million has made the story an industry headline, framing it as an example of oversized budgets and box-office risk. That financial drama is amplifying already intense critical coverage—reviews debate its three-hour scope, political themes and strong performances. Big-name director + hot-button subject matter + a massive projected loss = nonstop coverage (and some very nervous studio accountants).","Paul Thomas Anderson's new 2025 thriller One Battle After Another — reportedly starring Leonardo DiCaprio and inspired by a Thomas Pynchon work — has just opened. Critics and audiences are sharply divided: some hail it as a masterpiece while box-office returns are dismal, with projections of roughly $100 million in theatrical losses. The combo of rave reviews, money-loss headlines and noisy debates across Reddit, YouTube and Instagram is driving traffic to the Wikipedia page."
2025-10-14,2026 FIFA World Cup qualification – CAF Group C,A qualifying group for the 2026 FIFA World Cup featuring Nigeria and South Africa.,"CAF Group C produced last‑day drama: South Africa sealed a World Cup spot despite a points deduction, Benin briefly held the lead, and Nigeria roared back with a 4–0 win to force play‑off permutations. The tangled qualification scenarios and last‑minute shifts left fans and analysts frantically recalculating who goes to the 2026 finals. A standout performance from Victor Osimhen and unexpected twists made the story irresistible to football audiences.","South Africa sealed direct qualification for the 2026 World Cup with a dramatic 3–0 win over Rwanda, finishing top of CAF Group C. Nigeria earned a second‑round play‑off spot while Benin tumbled from first to third on the final matchday, adding extra intrigue. Final‑day drama, highlight clips and FIFA coverage drove fans to the Group C Wikipedia page to check standings and goalscorers."
2025-10-14,John Candy,A Canadian actor and comedian known for his roles in 1980s comedy films.,"A new documentary, I Like Me, plus a fresh biography have reignited interest in John Candy’s career and personal story. Big-name involvement (Colin Hanks, Ryan Reynolds), a sold‑out TIFF screening and streaming/Amazon distribution have driven reviews and profile pieces. Coverage mixes affectionate recollections of his warmth and comic gifts with critics noting how hard it is to make a probing film about someone so universally liked.","A new documentary, John Candy: I Like Me, hitting Amazon Prime has prompted fresh coverage and retrospectives in outlets like the NYT and People. Candy’s son publicly condemned resurfaced interviews that mocked his weight, which stirred headlines and debate about how interviewers treated him. Combined with pieces revisiting his life and death, fans are rewatching his work and remembering his big, warm laugh."
2025-10-14,Katy Perry,An American singer and songwriter known for her influence on pop music.,"Photos of Katy Perry kissing and cuddling former Canadian prime minister Justin Trudeau on a yacht have turned rumor into news. The unexpected pop-star/one-time-pm pairing is intrinsically attention-grabbing, and visible PDA makes the story concrete rather than speculative. Follow-up details — secret dates, FaceTime chatter and tabloid hot takes (even “midlife crisis” quotes) keep outlets running updates. It’s gossip with a political twist — glamorous, surprising and hard to ignore.","Katy Perry is trending after outlets reported she’s romantically linked to former Canadian prime minister Justin Trudeau. Paparazzi photos of the two kissing on her yacht and Perry’s cheeky onstage reaction — including turning down a fan’s proposal — have fueled the story. Viral clips and widespread media pieces have amplified the buzz, mixing celebrity romance with political intrigue."
2025-10-14,Blake Snell,An American professional baseball pitcher for the Los Angeles Dodgers in MLB.,"Blake Snell threw a near‑perfect eight innings in NLCS Game 1 — one hit, faced the minimum and struck out ten — handing the Dodgers a 2–1 victory. Because it was a dominant postseason outing on a big stage, the performance invites historical comparisons (Sandy Koufax talk), highlights his big contract narrative, and underscores the Brewers’ failure to adjust. Fans, pundits and contract‑watchers are reveling in the tidy postseason masterpiece.","Blake Snell dazzled in NLCS Game 1, throwing eight innings of one‑hit, 10‑strikeout, no‑walk ball while facing the minimum — a rare, historic playoff outing. Clips, recaps and hot takes from ESPN, YouTube, Reddit and major outlets have amplified the performance and comparisons to legends like Sandy Koufax. That dominant start for the Dodgers is driving the surge in attention."
2025-10-14,Premanand Govind Sharan,An Indian Hindu ascetic and guru associated with the Radha Vallabh Sampradaya.,"Premanand Govind Sharan, a well‑known Vrindavan saint, became the focus after reports about his kidney failure (polycystic kidney disease) circulated. Viral videos — one showing him laughing, others showing devotees’ emotional reactions and offers to donate kidneys — plus an ashram clarification and an interfaith prayer from Madinah amplified attention. The mix of health alarm, hopeful footage and touching unity gestures made the story highly shareable and conversation‑driving online.","Reports say Premanand Govind Sharan (Premanand Ji Maharaj) has polycystic kidney disease and is on dialysis, prompting concern about his health. Devotees have launched prayer campaigns and some have even offered to donate kidneys, while official social posts and viral videos show health updates and reassurance. Media stories and social buzz from these developments have driven people to his Wikipedia page. Devotion, apparently, has gone quite organ-ic."
2025-10-14,Anthony Perkins,An American actor known for his acclaimed Broadway debut in Tea and Sympathy.,"Netflix's Monster: The Ed Gein Story — and a subplot tying Anthony Perkins/Norman Bates to Ed Gein — has pushed Perkins back into headlines. Viewers and critics have called that storyline ""tasteless"" and flagged the show's added gore and nudity versus Hitchcock, prompting backlash and explainers. The mix of controversy, historical curiosity, and renewed interest in Perkins's career explains the wave of biographies, reviews and think pieces — psycho meets popcorn.","Netflix's new season of Monster — subtitled The Ed Gein Story — includes a dramatized depiction of Anthony Perkins timed with the show's premiere and related publicity events. Viewers and critics are disputing the series' fictionalized treatment of Perkins and Hitchcock, prompting backlash. That controversy has driven fresh biographies, retrospectives and social posts about Perkins' life and struggles — a posthumous encore for the man behind Norman Bates."
2025-10-14,Ryan Wedding,A Canadian former Olympic snowboarder turned transnational drug trafficker.,"Ryan Seacrest’s surprise announcement that he’s newly ordained and volunteered to officiate Taylor Swift and Travis Kelce’s wedding turned a bit of celebrity theater into headlines. The story bundles three big names, the novelty of Seacrest’s ordination, and enduring public fascination with Swift’s personal life, making it instantly shareable. It’s essentially a rom‑com moment — light, gossip‑friendly content that media and social feeds picked up quickly.","Ryan Wedding, who represented Canada in snowboarding at the 2002 Winter Olympics, was added to the FBI's Ten Most Wanted list. Authorities allege he became a major transnational drug trafficker tied to one of Mexico's most powerful cartels. News articles and social posts are resurfacing his Olympic past alongside the new criminal allegations. From podium runs to a fugitive manhunt — a dramatic turn that explains the attention."
2025-10-14,Giorgia Meloni,An Italian politician serving as Prime Minister since 2022 and leading Brothers of Italy.,"A viral clip of President Trump repeatedly calling Prime Minister Giorgia Meloni “beautiful” at the Gaza summit has driven intense coverage. That moment — plus Trump promoting her book, her prominent role as the only woman onstage, and attention-grabbing quips (about quitting smoking) and visits with leaders like Erdogan and Macron — has kept her name in headlines. The result is a mix of personality-driven virality and serious diplomatic positioning fueling the interest.","Her appearance at the Gaza peace summit in Sharm el‑Sheikh generated viral footage. Donald Trump repeatedly called her ""beautiful"" on stage, which drove heavy media and social‑media reaction. A separate tabloid quip about quitting smoking kept the attention rolling."
2025-10-14,Charlie Hunnam,An English actor known for portraying Jax Teller in Sons of Anarchy.,Charlie Hunnam's intense turn as Ed Gein — notably his controversial vocal choice — has ignited debate about authenticity and taste. His public defense of the show's depiction and interviews about unsettling production research kept the conversation going. Casting and production news (he’s returning for season 4 with a Lizzie Borden storyline) plus a quirky side note — a stapler-and-lamp burglary at his LA office — added fresh media hooks.,"Charlie Hunnam is trending after starring as real-life killer Ed Gein in Netflix’s Monster: The Ed Gein Story. His vocal choices and depiction have prompted mixed reactions and criticism, and Hunnam has been doing interviews to defend the show. Behind‑the‑scenes clips and viral social posts have fueled online debate — part fascination, part controversy."
2025-10-14,Boots (TV series),An American military drama about a closeted gay teenager enlisting in the Marines.,"Netflix just released Boots, a new miniseries adapted from Greg Cope White’s memoir about a closeted gay Marine recruit.  
Reviewers and explainers — from Time and NYT to The Guardian and Variety — are dissecting its frank take on military homophobia, Miles Heizer’s performance, and the late Norman Lear’s involvement.  
Mixed reactions (praise for sensitivity vs. notes of predictability and odd tonal choices) plus strong word‑of‑mouth and political-readings have turned it into a hot media conversation.","Netflix's limited series Boots, adapted from Greg Cope White's memoir The Pink Marine, just debuted on Netflix and is generating heavy press and word‑of‑mouth — yes, it's making boots squeak in the press. Critics and outlets are discussing its portrayal of a gay recruit confronting military homophobia and some odd tonal choices that keep viewers talking. Cast interviews and articles about the show's true‑story basis have driven people to the Wikipedia page."
2025-10-14,Madagascar,"An island country in the Indian Ocean, known for its biodiversity and unique wildlife.","Mass youth-led protests in Antananarivo escalated into a political crisis after President Andry Rajoelina said he was sheltering from threats, then fled the country. The army moved in, Parliament impeached and ousted him, and crowds reportedly cheered — a rapid collapse of order that produces dramatic visuals and clear news value. That swift sequence of street unrest, presidential exile and a military takeover is driving heavy coverage across outlets.","An elite military unit seized power after weeks of Gen Z‑led protests over poverty, power cuts and governance, and President Andry Rajoelina fled or went into hiding. Parliament moved to impeach him as the army declared control and clashes left several dead, prompting alarm. Intense international coverage and uncertainty about who now runs the country have driven many people to the Madagascar Wikipedia page — even the lemurs seem intrigued."