trending_date,normalized_title,summary,news_relation,search_relation
2025-10-12,Diane Keaton,An American actress known for her work in the New Hollywood movement and collaborations with Woody Allen.,"Diane Keaton’s reported death at 79 — the Oscar‑winning star of Annie Hall and The Godfather — is driving the headlines. Follow‑ups such as released dispatch audio, reports of a rapid health decline and her putting a “dream home” up for sale, plus tributes from co‑stars like Woody Allen and Al Pacino, gave reporters multiple fresh angles. Plus, the internet promptly did what it does best: flooded timelines with memories, tributes and hot takes, amplifying the coverage.","Major outlets report Diane Keaton has died at 79, prompting obituaries and tributes. Attention is also on an unrevealed cause of death after a 911 recording surfaced, and peers like Woody Allen have issued remembrances. Her Wikipedia page was updated as readers revisit her career — many recalling Annie Hall and those famously quirky hats."
2025-10-12,Ed Gein,An American murderer known for exhuming corpses and killing two women in Wisconsin.,"Netflix's new Monster season about Ed Gein has ignited debate over its graphic content and accusations it romanticizes a real-life killer. Big names (Ryan Murphy, Charlie Hunnam), fact-vs-fiction threads and even new claims tying Gein to other cases have kept coverage rolling. Critics, explainers and reviews are colliding — gory TV that doubles as combustible cultural commentary.","Netflix's new Ryan Murphy episode ""Monster: The Ed Gein Story,"" plus casting buzz around Addison Rae, has driven people to look up Gein. Recent articles and fact-checks (People, A&E, Britannica) calling out fabricated scenes and disputed claims — like an alleged engagement — are fueling searches. Viral clips and social posts about the show and its finale are also sending traffic to the Wikipedia page. True‑crime TV has resurrected an old ghoul."
2025-10-12,Ian Watkins (Lostprophets singer),"A Welsh singer and child sex offender, he led the band Lostprophets.","Ian Watkins — the disgraced former Lostprophets frontman serving time for child sex offences — was killed in a prison attack. Two men have been arrested and charged, turning it into an active murder investigation. The mix of celebrity, his notorious convictions, and a violent death in custody explains the intense media and public interest.","Multiple major outlets report that Ian Watkins, the former Lostprophets frontman and convicted child sex offender, was killed in a prison attack. Police have arrested two men on suspicion of murder and Wikipedia was updated to reflect his death, driving the surge in interest. A grim crossover of rock history and true‑crime coverage has pushed the article into the headlines."
2025-10-12,Google Chrome,"A cross-platform web browser developed by Google, first released in 2008.","Chrome is in the news because Google is changing how notifications work—auto-silencing noisy prompts and auto-revoking permissions for sites you don’t visit—so users and publishers are scrambling to adapt. Simultaneously, urgent security patches for critical memory‑handling flaws have made updating Chrome a priority. Add debates over built‑in AI features and comparisons to new AI browsers (plus takeover chatter), and you get a feed full of headlines and user anxiety — like a browser trying to be a quieter, safer houseguest and everyone taking notes.",A new stable Chrome release (141.0.7390.65/.66) rolled out this week with bug and security fixes. Media coverage called out a change that automatically silences notifications from sites you haven’t interacted with and an Android feature for automatic passkey creation. Security bulletins and explainer videos about patched vulnerabilities pushed the story into trending.
2025-10-12,Lostprophets,A Welsh rock band formed in 1997 by Ian Watkins and Lee Gaze.,"Ian Watkins — the disgraced former Lostprophets singer convicted of child sex offences — was reportedly killed in a prison attack. News outlets escalated coverage after police said two men were arrested and charged, making this an active murder investigation rather than just a historical update. His notoriety, the violent circumstances in custody, and questions about prison safety and accountability have pushed the story into headlines as a grim coda to a notorious case.",Most traffic to the Lostprophets page follows reports that former frontman Ian Watkins was killed in a prison attack. Media coverage notes two men have been arrested/charged and recalls Watkins’s 2013 conviction and lengthy sentence. The high-profile prison killing combined with his notorious crimes has driven renewed public interest in the band and its members.
2025-10-12,Kantara: Chapter 1,A 2025 Indian Kannada-language mythological action film exploring ancestral conflict and tradition.,"Kantara: Chapter 1 is trending after an unexpected, record‑shattering box‑office run. It rocketed through milestones—hitting roughly Rs.290–334 crore in the first week and later being reported past the Rs.500 crore mark worldwide—overtaking several big releases. Strong word‑of‑mouth, rave reviews about its theatrical experience, and actor/director interviews have kept the story in the news.","Kantara: Chapter 1 is trending after its recent release and a huge box-office haul — reports cite around ₹600 crore and placement among India's top-grossing films. Trade coverage is probing whether the sequel actually turned a profit given a much larger production budget than the original. Social-media reels, a Hindi release push and comparisons to blockbusters keep fans cheering while accountants squint."
2025-10-12,Monster: The Ed Gein Story,A biographical crime drama about convicted murderer Ed Gein and true crime culture.,"A new Netflix season dramatizing Ed Gein — with Charlie Hunnam and Ryan Murphy attached — has reignited debate about glamorizing a real, gruesome killer. Critics and opinion columns call the show exploitative and too graphic, while explainers and cast comparisons keep viewers clicking. That mix of controversy, celebrity names, and true‑crime curiosity is driving the coverage.","Netflix's new limited series Monster: The Ed Gein Story recently premiered. Critics say it humanizes and sensationalizes a real killer and that several scenes were fabricated, prompting debate over ethics and accuracy. Big-name casting and viral social-media and YouTube coverage have amplified the controversy, turning the release into a noisy true‑crime conversation."
2025-10-12,Role Model (singer),An American singer-songwriter known for his albums and online following.,"Role Model’s SNL musical-guest debut made headlines when he staged a surprise cameo by Charli XCX as his onstage “Sally” during “Sally, When the Wine Runs Out.” The moment amplified an already-viral concert gimmick—fans shouting “Where’s my Sally?” and different singers answering—so the trope moved from shows to TV. Debate over Charli’s look (some reading it as a Taylor Swift wink) plus mixed reviews of the stunt kept outlets talking.","A Saturday Night Live debut performing ""Sally, When the Wine Runs Out"" sent searches for Role Model surging. Charli XCX made a surprise cameo as the song’s ""Sally,"" amplifying interest. Viral clips and coverage on YouTube, Reddit and outlets like Billboard and Hollywood Reporter bumped his Wikipedia page into trending lists."
2025-10-12,Dennis Rader,An American serial killer known as the BTK killer murdered at least ten people.,"A new Netflix documentary narrated by Kerri Rawson — the daughter of Dennis Rader — reframes the infamous BTK case through a personal, emotional lens, which hooks readers. Many outlets are pairing that film release with fresh reporting about Rader’s crimes, his family’s shock, and recent prison confrontations, giving editors timely material. The combination of true‑crime notoriety, a family perspective, and renewed developments makes the story hard to ignore.","A new Netflix documentary, My Father: The BTK Killer, told from Dennis Rader’s daughter’s perspective, has driven renewed coverage. Major outlets and social posts are revisiting his crimes, family ties, and current prison status. The intimate angle — a child grappling with a notorious parent's legacy — is fueling public curiosity."
2025-10-12,Ilse Koch,A German war criminal notorious for atrocities at Buchenwald concentration camp.,"Netflix's Monster: The Ed Gein Story puts Ilse Koch — a notorious Nazi war criminal — back in the narrative, so outlets are running primers on who she was and the real crimes tied to her name. Reporters are also fact‑checking the show's dramatizations, asking whether Gein actually knew Koch and whether specific scenes (a hospital killing, links to Ted Bundy) have any historical basis. The mix of a popular true‑crime series, a notorious historical figure, and debates over accuracy has driven the wave of explainers and critiques.","A Netflix series, Monster: The Ed Gein Story, has reintroduced Ilse Koch to contemporary audiences. Recent pieces revisit her wartime crimes and the lurid — and legally contested — claims that she collected items made from human skin, while probing whether Ed Gein was inspired by her. That renewed true‑crime coverage has driven the surge in articles and searches."
2025-10-12,2026 FIFA World Cup qualification (UEFA),The European qualifiers for the 2026 FIFA World Cup will offer 16 slots.,"Matchday 8 has piled up decisive UEFA fixtures, so fans and casual readers are hunting the qualification overview for standings and permutations. Big matches (Portugal v Ireland), headline-grabbing performances (Cody Gakpo) and stories on who can clinch spots this week make the topic immediately relevant. Practical pieces on how to watch qualifiers and a UEFA hinting at format changes add news hooks and debate. In short: World Cup drama plus a potential rule shake-up has everyone refreshing the qualification page.","European qualifying is in full swing after Matchday 8, with a flurry of results reshuffling group tables. Big wins for Belgium, Germany and the Netherlands plus shocks such as the Faroe Islands upsetting Czechia and Iceland holding France have intensified qualification permutations. Fans are flocking to the Wikipedia page for up‑to‑date group standings and play‑off scenarios — and maybe to refresh their hopes."
2025-10-12,Katy Perry,"An American singer and songwriter, known for her influence on pop music.","Paparazzi photos show Katy Perry and former Canadian prime minister Justin Trudeau kissing and cuddling on her yacht. The pairing of a global pop star with a high-profile political figure — plus shirtless, steamy images — turns months of rumor into apparent confirmation. Tabloid exclusives and widespread social sharing have amplified the coverage. It’s the sort of celebrity-meets-statesman gossip the internet can’t resist.","Photos and video of Katy Perry kissing former Canadian prime minister Justin Trudeau on a yacht have circulated online, sparking romance speculation. People and other outlets ran exclusives about their dates and alleged pursuit, while social posts and YouTube clips amplified interest. Pop star + ex-PM = headline fuel, and the timing alongside Perry’s tour kept attention high."
2025-10-12,Tron: Ares,A 2025 American science fiction action film and third installment in the series.,"A new Disney ""Tron"" sequel has arrived, and the neon‑soaked spectacle of reviving a decades‑old franchise is drawing attention. Critics commonly praise the visuals and pulsing soundtrack but slam the thin story and uncharismatic lead. Heated debate over two big, confusing retcons to franchise continuity has amplified coverage and fan discussion.","Mixed-to-negative reviews and a softer-than-expected $33–35 million opening have kicked off a lot of chatter. Angry Reddit threads, viral YouTube takedowns, and comparisons to past Tron films are amplifying criticism (one snarky post even quipped they'd rather have AI direct the next one). Questions about its Disney+ release timing and the franchise’s future are driving extra searches."
2025-10-12,Woody Allen,An American filmmaker and comedian with numerous awards and accolades spanning eight decades.,"Diane Keaton’s death plus Woody Allen’s affectionate essay — calling her “so charming, so magical” — pushed the story into heavy circulation. Allen’s long creative partnership with Keaton and his own notoriety make anything he writes about her especially newsworthy. Major outlets running both the obituary and his tribute created a quick, clickable feed of coverage — a celebrity‑death + famous‑ex Hollywood cocktail.","Allen has penned a lengthy, glowing tribute to Diane Keaton after her death at 79, published in The Free Press. Their long romantic and creative partnership — including Annie Hall — and his own controversial history make his public eulogy especially newsworthy. Quotable lines from the essay are being circulated by major outlets and social posts, pushing the Woody Allen article up trending lists."
2025-10-12,Annie Hall,A satirical romantic comedy-drama about a man's failed relationship with a woman.,Diane Keaton’s death at 79 has prompted a rush of obituaries and retrospectives across major outlets. A New York Times piece reframing her Annie Hall wardrobe as an integral part of her artistry is surfacing now as readers seek meaning beyond the headlines. Interest in both the breaking news and deeper cultural reassessments is driving the article’s visibility.,"Diane Keaton's death has driven renewed interest in Annie Hall. Obituaries, essays about her iconic film look, and AMC's planned re‑runs are sending readers to the movie's Wikipedia page. Fans are even revisiting the bowler hats and khaki trousers."
2025-10-12,Michelle Trachtenberg,An American actress known for roles in Nickelodeon series and Harriet the Spy.,Sarah Michelle Gellar's heartfelt Instagram tribute marking what would have been Michelle Trachtenberg's 40th — and the fact it's her first birthday since Trachtenberg's death at 39 — has driven heavy coverage. Ongoing questions and reporting about the circumstances of her recent death amplified public interest. Buffy-era nostalgia and the emotional weight of a milestone birthday keep fans and outlets talking.,"Fans and former costars are marking what would have been Michelle Trachtenberg’s 40th birthday, prompting renewed media and social-post attention. Sarah Michelle Gellar and others posted heartfelt tributes recalling her role as Dawn on Buffy and her Nickelodeon-era fame. That remembrance, along with renewed online discussion and videos about her February death, has driven the recent flurry of coverage."
2025-10-12,2026 FIFA World Cup qualification,The qualification process will determine 45 teams for the 2026 FIFA World Cup.,"Because qualifying for the expanded 2026 World Cup is in full swing across confederations, there are lots of moving parts — who’s already through, who’s close, and who’s been called into national squads. High-profile moments (Mo Salah sealing Egypt’s place), club-level impact (players missing matches for country), and new format details, including the play-off tournament, are feeding constant coverage. Fans and media are tracking results, brackets and seeding closely as the U.S./Mexico/Canada hosts will see a very different, bigger tournament.","Recent qualifier results and live FIFA updates have pushed readers to the page. Cabo Verde (Cape Verde) just clinched its first-ever World Cup spot, a historic milestone that’s getting heavy coverage. Updated lists of which teams have qualified are also prompting people to check the article."
2025-10-12,Valentin Vacherot,A Monégasque professional tennis player with a career-high singles ranking of No. 40.,"Valentin Vacherot, a low‑ranked qualifier, produced a fairy‑tale run at the Shanghai Masters by stunning Novak Djokovic and then claiming his first ATP title at the Masters 1000 level. The final added an irresistible twist: he defeated his cousin Arthur Rinderknech, creating a rare cousin‑versus‑cousin championship. The combination of a huge upset, a first‑time champion and the family angle drove the article’s attention.","Valentin Vacherot is trending after an improbable run to the 2025 Shanghai Masters title. The world No. 204, a qualifying alternate, beat his cousin Arthur Rinderknech in the final to claim his first ATP Tour singles trophy. His victory makes him the first player representing Monaco to win an ATP singles title — a tiny nation having a giant tennis moment."
2025-10-12,Charlie Hunnam,An English actor known for portraying Jax Teller in Sons of Anarchy.,"Charlie Hunnam’s intense, method‑style turn as Ed Gein — including reports he kept a creepy voice on set and later panicked about taking the role — is driving the coverage. Behind‑the‑scenes anecdotes and his public defense of the material have stirred debate over authenticity and taste while critics harshly review the show. Add awards chatter and news he’s returning for more Monster seasons, and you get controversy, curiosity, and persistent headlines.","A new portrayal of Ed Gein in Ryan Murphy’s Monster has put Charlie Hunnam in heavy press rotation. Coverage focuses on his near‑30‑pound weight loss, his defense of how the series portrays real crimes, and strong notices alongside Laurie Metcalf. WIRED interviews, Netflix clips and social posts — plus an eyebrow‑raising Addison Rae mention — have kept online interest bubbling."
2025-10-12,Psycho (1960 film),A 1960 horror film about an embezzler and a disturbed motel proprietor.,"A new Netflix series, Monster: The Ed Gein Story, has reignited curiosity about whether Norman Bates was modeled on a real killer. Multiple outlets are unpacking Hitchcock’s choices, Anthony Perkins’ legacy, and which details are fact versus fiction. A 65th‑anniversary run and local screenings add timely momentum, so readers are revisiting Psycho alongside the true‑crime drama.","Recent coverage revisiting Psycho’s ties to real-life killer Ed Gein—prompted by articles and a new true‑crime dramatization—has reignited interest. A flurry of YouTube reactions, retrospectives and pieces marking the film’s 65th anniversary have driven viewers back to Hitchcock’s classic. That combo has people rewatching, debating how much Bloch and Hitchcock borrowed from Gein and fact‑checking the lore."
2025-10-12,Richard Speck,An American mass murderer killed eight student nurses in Chicago in 1966.,"Netflix's Monster: The Ed Gein Story dramatizes Richard ""Birdman"" Speck and even imagines a creepy letter exchange with Ed Gein, which has reignited curiosity about Speck's crimes. News outlets are fact‑checking the show’s claims, profiling the real man behind the nickname, and noting the familiar actor choices that make viewers do a double take. True‑crime sensationalism plus debates over historical accuracy (and a hit streaming release) is driving the coverage — part courtroom briefing, part guilty‑pleasure gossip.","Netflix’s new series Monster: The Ed Gein Story features a portrayal of Richard “Birdman” Speck, bringing the 1966 mass murderer back into public conversation. Reporters and fact‑checkers are debating the show’s accuracy—especially claims about whether Gein and Speck exchanged letters—and publishing background pieces on Speck’s crimes. Social posts from the actor and quick explainers have sent viewers scrambling to verify what the drama changed, so true‑crime fans are playing detective online."
2025-10-12,One Battle After Another,A 2025 action thriller about an ex-revolutionary pursued by a corrupt military officer.,"Paul Thomas Anderson’s new three‑hour film One Battle After Another — with Leonardo DiCaprio, Benicio Del Toro and Sean Penn — is getting heavy review coverage for its performances and bold filmmaking. Conservative critics are simultaneously attacking it as politically inflammatory, turning acclaim into controversy. The mix of A‑list talent, formal ambition, festival/screening buzz and political debate is driving the conversation.","Paul Thomas Anderson's 2025 action thriller One Battle After Another is trending after its release, posting solid box-office numbers and provoking sharply mixed reviews. A high-profile Q&A (moderated by Steven Spielberg) plus social-media buzz — even a Kevin Bacon Instagram shout-out — has amplified attention. Conservative critics alleging the film could inspire left-wing violence have injected a political controversy that further intensified coverage."
2025-10-12,María Corina Machado,A Venezuelan politician and activist opposing Hugo Chávez and Nicolás Maduro's governments.,"Multiple outlets report María Corina Machado has been awarded the 2025 Nobel Peace Prize.  
The prize honors her leadership of Venezuela’s pro‑democracy movement after years of repression, including being banned from running and forced into hiding.  
That high‑profile recognition quickly amplified her story, triggering intense global news, NGO commentary and viral social media attention.","María Corina Machado won the 2025 Nobel Peace Prize. She dedicated the award to Venezuelans fighting for democracy and publicly thanked US President Donald Trump, which generated intense media coverage. That high-profile honor combined with a controversial political endorsement pushed her Wikipedia page up the trends."
2025-10-12,Charles Oliveira,A Brazilian mixed martial artist and former UFC Lightweight Champion competing in the Lightweight division.,"Charles Oliveira returned to Brazil and submitted Mateusz Gamrot in the UFC Rio main event with a vintage ""Do Bronx"" rear‑naked choke. The finish extended his perfect 18‑0 record at home and served as a dramatic rebound just 105 days after a brutal KO loss. He immediately called out Max Holloway for a BMF‑style lightweight showdown, turning the win into a potential high‑profile matchup.","Charles Oliveira just scored a second‑round rear‑naked choke over Mateusz Gamrot at UFC Rio, celebrating with the Brazilian crowd. The finish tied him with Cro Cop for most stoppages, rekindled GOAT/BJJ arguments, and prompted him to call out Max Holloway for a dream rematch. A return to Brazil after five years plus renewed BMF‑title chatter pushed his page into trending."
2025-10-12,Justin Trudeau,A Canadian politician who served as prime minister from 2015 to 2025.,"Photos of Katy Perry and former Canadian prime minister Justin Trudeau passionately kissing on her yacht circulated across tabloids and mainstream outlets. The unexpected pairing of a global pop star and a high-profile political figure — plus visible PDA after months of rumors — makes the item irresistible to readers. It reads like a political-romcom headline, fueling curiosity about private lives and political optics.","Viral photos and footage of Justin Trudeau kissing pop star Katy Perry on a yacht off Santa Barbara have reignited dating rumors. His ex‑wife Sophie Grégoire Trudeau’s cryptic social‑media post plus heavy media reaction and trolling amplified interest. A yacht, a kiss and the internet obliged — people are checking his Wikipedia page for background and the timeline of their split."
2025-10-12,Curt Cignetti,An American college football coach known for leading teams to consecutive 10-0 starts.,"A halftime TV interview in which Cignetti served up dry humor and then bluntly ripped the officials and his own team went viral, spawning clips and reactions. That moment arrived as Indiana is booming — a shocking upset in Eugene, NIL/Money chatter and Penn State coaching rumors — so the clip ties into bigger narratives. Entertaining soundbites plus real-season stakes made the piece irresistible to sports pages and social feeds.","Indiana’s coach Curt Cignetti has pushed the Hoosiers to a top‑3 national ranking and is being linked to a potential Penn State opening amid James Franklin firing rumors. Media figures and outlets (Todd McShay, USA Today, IndyStar) are dissecting whether he’d leave, digging into his contract, buyout and fit. Hot record + vacancy gossip + buyout numbers = coaching‑carousel fever."
2025-10-12,Lizzie Borden,An American woman acquitted of the 1892 axe murders of her father and stepmother.,"Netflix’s Monster anthology turning Season 4 to the infamous Lizzie Borden — with production beginning in Los Angeles — is being widely covered. Big-name elements (creator Ryan Murphy, returning star Charlie Hunnam, and Ella Beatty cast as Borden) plus true‑crime appeal make the news bitey. Add an enduring nursery rhyme and a notorious murder case, and curiosity (and clicks) follow.","Netflix's Monster Season 4 — a Ryan Murphy anthology episode about Lizzie Borden — was announced and has begun filming, with Ella Beatty cast as Borden. Major outlets and Netflix promotional pages are running casting and production coverage. That renewed publicity has revived interest in the 1892 axe murders and the Borden house as a visitor attraction."
