trending_date,normalized_title,summary,news_relation,search_relation
2025-10-12,KPop Demon Hunters,An animated musical film about a K-pop girl group who are demon hunters.,"A runaway Netflix hit—still #1 after 111 days—has made KPop Demon Hunters impossible to ignore. Its cross-generational appeal and pop‑hit soundtrack, capped by a Tonight Show performance, keep media and audiences engaged. Conversations about representation and the creator teasing more stories or a live‑action adaptation sustain industry interest. Quirks and debates—it's not actually a Korean film, fans dressing it for Halloween, and even its use in a theology class—send it bouncing around headlines like a cultural boomerang.","A spike in traffic follows the cast's high‑profile TV performances — clips of ""Golden"" on Jimmy Fallon have racked up millions of views. Coverage that the creators rejected a live‑action movie offer has generated fresh industry headlines. Ongoing fan events, debates about age‑appropriateness, and a surprise platinum moment have kept people clicking through. It’s part monster‑movie, part K‑pop mania — and the internet can’t get enough."
2025-10-12,James Franklin (American football coach),An American college football coach who led teams at Vanderbilt and Penn State.,"A sudden, high‑profile firing of Penn State coach James Franklin after a string of losses — capped by an upset to Northwestern — has driven intense media and fan coverage. The program’s national relevance, the quick appointment of an interim coach, and immediate speculation over top replacement candidates keep the story evolving. It’s dramatic, consequential for College Football Playoff hopes, and the kind of cliffhanger that fuels social media chatter.","Penn State fired James Franklin after a 3–3 start to the 2025 season, ending his 12-year tenure as head coach. Attention spiked because the school must pay roughly $49 million to buy out his contract, one of the largest payouts in college football. Media and fans are already debating replacement candidates and the hot 2025 coaching carousel, driving searches and coverage."
2025-10-12,Anthony Perkins,An American actor known for his acclaimed Broadway debut in Tea and Sympathy.,"Netflix's Monster: The Ed Gein Story reimagines Anthony Perkins and the making of Psycho in ways critics call lurid and historically loose. Historians, fans and LGBTQ outlets have objected to added gore and an allegedly ""tasteless"" depiction of Perkins' sexuality. The dispute over accuracy and the ethics of dramatizing a real actor’s life is driving the coverage.","Netflix's new series Monster: The Ed Gein Story (Season 3) dramatizes Ed Gein and portrays Anthony Perkins, prompting renewed attention. Critics and viewers accuse the show of inventing or misrepresenting Hitchcock's casting and Perkins' life, sparking backlash and a flurry of articles and social posts. Old Hollywood gossip is getting a second life, which explains the sudden spike in searches."
2025-10-12,Sophie Grégoire Trudeau,A Canadian retired television host involved in charity and social work.,"Photos of Katy Perry and Justin Trudeau kissing on a yacht have reignited interest in Trudeau's personal life. That attention has pushed pieces about Sophie Grégoire Trudeau — her separation, reactions and background — back into circulation as readers seek context. The mix of celebrity romance and a high‑profile political marriage makes Sophie an obvious follow‑up story.","Photos surfaced of Justin Trudeau kissing Katy Perry, sparking fresh attention on his private life. Sophie Grégoire Trudeau then posted a cryptic Instagram message about letting go and impermanence the following day, which outlets cast as a pointed response. Tabloid and entertainment sites have amplified the back-and-forth, sending searches for her name higher."
2025-10-12,Deaths in 2025,"Notable deaths in 2025 listed by date, including age and cause of death.","A wave of obituaries and official reports has clustered around deaths in 2025, from celebrity memorials to government tallies. The El País story is drawing attention because it reports migrant deaths in ICE custody at a 20‑year high and links those fatalities to recent violent incidents, making it both tragic and news‑political. The mix of human loss, questions about detainee healthcare and agency practices, and calls for accountability is keeping the piece in public conversation.","Multiple recent high-profile obituaries and celebrity deaths have driven people to the ""Deaths in 2025"" page. News galleries and obituary roundups in the search results show several notable names being reported and memorialized, so readers are consulting Wikipedia as a quick aggregated list. Think of it as the internet's communal guestbook getting unexpectedly crowded."
2025-10-12,John Candy,A Canadian actor and comedian known for iconic 1980s comedy films.,,"A new Colin Hanks–directed documentary, John Candy: I Like Me, recently premiered and began streaming on Amazon Prime, prompting fresh reviews. Major outlets and a new Paul Myers biography are revisiting Candy’s life, career and his 1994 death. Fans and critics are sharing clips and memories online, so his warmth and comic work are back in conversation."
2025-10-12,UFC Fight Night: Oliveira vs. Gamrot,"A mixed martial arts event held in Rio de Janeiro on October 11, 2025.","Charles Oliveira headlining a UFC Fight Night in Rio against Mateusz Gamrot is an obvious draw — it’s a hometown main event with big stakes. Oliveira’s unbeaten run at home and the winner’s path back toward marquee fights (and maybe a BMF-style payday) give the matchup narrative weight. Betting guides, expert picks, live streams and posted scorecards keep fans, bettors and pundits clicking in real time.","A UFC Fight Night in Rio headlined by Charles Oliveira vs. Mateusz Gamrot took place Oct. 11. Oliveira finished Gamrot with a rear‑naked choke at 2:48 of Round 2, producing viral highlight clips and the crowd erupted. Official scorecards, video highlights and live discussion threads on ESPN, UFC.com, YouTube and Reddit are driving traffic. Oliveira remains unbeaten in Brazil, which gives fans an extra storyline to chew on."
2025-10-12,The Woman in Cabin 10,"A psychological thriller film directed by Simon Stone, based on a novel by Ruth Ware.","Netflix’s high-profile adaptation of The Woman in Cabin 10 — led by Keira Knightley — landed with a twisty ending that has viewers talking. Critics are split and outlets are publishing reviews, ending explainers, and book‑vs‑movie roundups, which fuels the debate. Niche angles like the superyacht used in filming and Knightley’s own surprised reactions keep the story bobbing in the cultural conversation.","A Netflix film adaptation of Ruth Ware’s The Woman in Cabin 10 starring Keira Knightley premiered this week. Coverage centers on its twisty ending, book‑to‑movie changes and mixed reviews. Explain‑it‑to‑me pieces, interviews and lively Reddit debate have driven the article’s recent surge."
2025-10-12,6-7 (meme),An internet meme from 2025 referencing gun violence and basketball player LaMelo Ball.,"A tiny numeric earworm — the ""6‑7"" line from Skrilla's ""Doot Doot"" — blew up on TikTok and was amplified by Gen Alpha, athletes, and even coaches stumbling over it in pressers. Coverage surged as creators, players (and the meme’s claimed inclusion on GTA 6) offered origin stories and recreations. The blend of catchy audio, sports tie‑ins, and baffled parents makes it an easy, clickable cultural moment.","A TikTok/Instagram Reels catchphrase — ""6-7"" — exploded after a viral clip and an unofficial song clip (""Doot Doot"") made the odd phrase memetic. Creators, shorts, and a recent interview with Jasper Johnson pushed explanations across platforms, driving people to search for the origin. Local-coverage and Reddit threads linking it to Ohio slang (meaning weird/cringe) and possible police-code references sent curious readers to the Wikipedia page."
2025-10-12,Ted Bundy,An American serial killer who kidnapped and murdered young women between 1974 and 1978.,"A Netflix finale shows Ed Gein helping investigators track down Ted Bundy, a provocative plot beat that grabbed attention. Reporters and fact‑checkers are dissecting the claim because it conflicts with historical records and true‑crime fans care about accuracy. Add Ryan Murphy’s name, a Mindhunter homage and a hungry audience for grisly twists, and it becomes irresistible clickbait — catnip for true‑crime obsessives.","Netflix's new series Monster about Ed Gein dramatizes a claim that Gein helped lead to Ted Bundy's arrest, which has driven fresh attention to Bundy's page. Journalists and fact-checkers are publishing pieces debunking or clarifying that portrayal, and related podcasts and viral videos are amplifying the discussion. The mix of dramatization plus corrective reporting is driving the spike in searches."
2025-10-12,Fuck,A profanity in English referring to sexual intercourse and used as an intensifier.,"Celebrities repeatedly using the F-word on stages and TV—most visibly Chappell Roan shouting “Fuck ICE” and drawing a Homeland Security response—has ignited heated coverage. The mix of blunt profanity, political targets and official pushback drives social-media argument and newsroom pickups. With comedians defending controversial appearances and actors piling on, the story keeps spiraling across outlets.","Top results are dictionary entries and usage guides, suggesting a spike in people looking up the word’s meaning and how it’s used. The results also mix porn links and a comedy show titled ""Fuck This Month,"" so both explicit content and pop-culture mentions are driving traffic. Most likely a recent viral utterance or newsworthy use prompted readers to check Wikipedia for context and acceptability."
2025-10-12,Joe Flacco,An American professional football quarterback for the Cincinnati Bengals in the NFL.,"Multiple outlets covered a surprising trade: the Browns sent veteran QB Joe Flacco to division rival Cincinnati. The Bengals, thin at quarterback without Joe Burrow, picked up an experienced short‑term option for minimal draft cost. Shocked reactions from both clubs and the move’s immediate effect on Cincinnati’s season and the AFC North made the story stick — NFL musical chairs, but with helmets.","He was traded from the Browns to divisional rival Cincinnati and was immediately inserted as the Bengals’ starter on short notice. Steelers coach Mike Tomlin slammed the move as ""doesn't make sense"" and ""shocking,"" which amplified coverage. A solid debut (219 yards, two TDs) plus reports the Bengals checked multiple QBs before the deal keep the story buzzing — midseason soap‑opera twist included."
2025-10-12,Mr. Olympia,An annual professional men's bodybuilding contest established by Joe Weider in 1965.,"Interest spiked after the Mr. Olympia 2025 finals in Las Vegas produced headline outcomes—Derek Lunsford claimed a second title while Hadi Choopan took runner‑up and People’s Champion honors. Multiple outlets ran results, prize‑money breakdowns, roster previews and replay guides, giving fans clear reasons to read. Casual viewers and hardcore bodybuilding fans alike are doing a little collective flexing over the winners, payouts and postseason drama.","Derek Lunsford won the 2025 Mr. Olympia, earning his second title and dethroning 2024 champion Samson Dauda. Results and recaps for multiple divisions (Classic Physique, Ms. Olympia, Men's 212, wheelchair bodybuilding) were posted across news sites, YouTube and social media. Fans are debating comparisons to past champions and sharing highlight clips, driving discussion. A mix of muscle, dramatic posing and hot takes keeps the conversation flexing online."
2025-10-12,Crown Jewel (2025),"A professional wrestling pay-per-view event held in Perth, Australia, featuring WWE wrestlers.",A star‑studded Crown Jewel in Perth anchored by John Cena vs. AJ Styles and Seth Rollins vs. Cody Rhodes grabbed attention. The show delivered headline outcomes — Rollins and Stephanie Vaquer won the new Crown Jewel titles — sparking reaction and grades. Being held in Australia (forcing U.S. morning viewing) and streaming on ESPN in the U.S. and Netflix internationally added novelty and wider news coverage.,"A recent WWE pay‑per‑view in Perth, Australia — Crown Jewel (2025) — drove the surge in interest. Highlights included Seth Rollins winning the Crown Jewel Championship, a notable John Cena/AJ Styles appearance, and headline bouts like Tiffany Stratton vs. Stephanie Vaquer. Post‑show results, clips, and rewatch requests pushed coverage and the Wikipedia page up the charts. Fans are happily replaying the finishes on loop."
2025-10-12,2026 FIFA World Cup qualification (CAF),The African qualification tournament for the 2026 FIFA World Cup offers nine slots.,"African qualifying is erupting into decisive, late-stage drama as final matchdays are deciding who reaches the expanded 2026 World Cup. Recent headlines show big outcomes — Ghana sealed qualification via Mohammed Kudus, Algeria and Egypt booked places, and tense showdowns (Cape Verde v Cameroon, Nigeria v Benin) could settle remaining berths. Add FIFA’s revamped format and new play-off path plus broadcast guides, and you get heavy coverage and audience interest.",Major changes to CAF's 2026 qualifying format and FIFA's expanded slots have renewed interest in the region's qualification race. Add to that on-field drama — notably Cabo Verde booking its first-ever World Cup place — and news outlets and social posts have been buzzing. Fans and pundits are also debating the new playoff details and who benefits from the revamped system.
2025-10-12,2026 FIFA World Cup,"The 2026 FIFA World Cup will be hosted by the United States, Canada, and Mexico.","With kickoff eight months away and qualification races accelerating, outlets are pushing frequent “who’s qualified” updates as teams clinch spots. Angry coverage of steep, dynamically priced tickets and a fiddly ticketing process is driving clicks and debate about access. Add in intense reporting on travel plans for host cities and host-country issues like immigration and climate, and fans are scrambling to figure out if they can afford — or even get to — the tournament.","Qualification rounds for the expanded 48‑team 2026 World Cup are underway, so every match and result is generating news. Recent headlines note surprise qualifiers like Cape Verde and Ghana and publish updated lists of who has already clinched spots. A fact‑check debunking claims that the US was excluded from hosting (and noting the final at MetLife) has also driven extra interest — fans are refreshing like it’s extra time."
2025-10-12,Boots (TV series),An American military drama series based on the memoir The Pink Marine.,"Major outlets are running reviews of Netflix's Boots, a queer coming‑of‑age drama about a closeted young Marine. Its timely angle — LGBTQ+ military policy conversations, a Norman Lear production credit, and Miles Heizer’s interviews — has amplified interest. Critics disagree (some call it heartfelt, others predictable), and that debate is keeping it in the news.","Netflix's new miniseries Boots, adapted from Greg Cope White's memoir The Pink Marine, premiered this week and is drawing media attention. Major outlets (NYT, LA Times, Variety) published reviews while interviews with star Miles Heizer and lively Reddit threads boosted conversation. Its plot about a closeted gay Marine recruit and notable names (Vera Farmiga, a Norman Lear credit) has pushed the article up the charts."