trending_date,normalized_title,summary,news_relation,search_relation
2025-10-14,D'Angelo,An American R&B musician recognized as a definitive neo-soul artist.,"D'Angelo’s death at 51, reported as due to pancreatic cancer, has driven the intense coverage. He was a Grammy‑winning neo‑soul pioneer with iconic songs like “Untitled (How Does It Feel),” so his passing prompts music‑world reaction and retrospectives. Reporting mixes tributes and career analysis with health explainers about pancreatic cancer, which keeps the story circulating.","Major news outlets report D'Angelo has died at 51 after a battle with pancreatic cancer. He was a Grammy‑winning neo‑soul artist best known for albums like Brown Sugar and Voodoo and the iconic ""Untitled (How Does It Feel)"" video. Tributes from fellow musicians and a rush to revisit his catalog explain the spike in attention — fans and press are replaying his work."
2025-10-14,Ed Gein,An American murderer known for exhuming corpses and confessing to two killings.,"A new Ryan Murphy Netflix series about Ed Gein has pushed the story back into public conversation. Critics and commentators are denouncing its graphic approach and accusing it of romanticizing the killer, while outlets publish fact-checks and reviews. Background pieces on victims, character comparisons and the burned farmhouse have deepened the debate about taste, accuracy and ethics.","A grisly new Netflix dramatization, ""Monster: The Ed Gein Story"" (Ryan Murphy), has just been released and is driving searches. Coverage is debating the film’s fictionalized elements — including a portrayed girlfriend, Adeline Watkins — and fact-checking scenes. Clips and explainers on Instagram, YouTube and outlets like Today, People and Britannica are funneling curious viewers to the Ed Gein page."
2025-10-14,Diane Keaton,An American actress known for her work in the New Hollywood movement and collaborations with Woody Allen.,"Diane Keaton's death at 79 — the Oscar‑winning, idiosyncratic star of Annie Hall, The Godfather and many beloved films — has prompted major obituaries and tributes. New reporting about a sudden health decline, her “dream home” being listed and released ambulance dispatch audio is fueling follow‑ups and public curiosity. Fans and colleagues are sharing memories and rewatching her work, so coverage mixes biography, breaking details and personal remembrances — and yes, a few people are probably reaching for a retro fedora.","Major news outlets and obituaries are reporting that Diane Keaton died at 79, and her Wikipedia page was quickly updated. Friends' remarks and reports she attended Jack Nicholson's recent party have sparked speculation about the cause of death. No official cause has been confirmed, so follow-up reporting and career retrospectives are driving interest. Fans are also revisiting her iconic roles — and her signature hats."
2025-10-14,Google Chrome,"A cross-platform web browser developed by Google, first released in 2008.","Google is adding a feature that automatically mutes or revokes notification permissions for inactive or noisy sites, promising fewer interruptions and tighter privacy control. Coverage is high because it’s a clear, user-facing change that affects both desktop and Android and follows other visible Chrome updates (like Gemini features and AI hooks). Quieter browsing is an easy sell — and catchy headlines make it shareable.","Google rolled out Chrome 141 on Android, pushing the browser back into headlines as the update reaches Google Play. A new feature auto-silences notifications from sites you haven’t interacted with, alongside security and performance fixes. Developer-focused moves — like built-in AI APIs for Chromebook Plus — and chatter from extension authors added extra buzz."
2025-10-14,2026 FIFA World Cup qualification,The qualification process will determine 45 teams for the 2026 FIFA World Cup.,"Major qualification developments — England becoming the first European side through and Cristiano Ronaldo breaking a record amid Portugal’s slip — have generated big headlines. Regional storylines (Africa’s dramatic race, South Africa’s “fairytale” chase, CONCACAF stalemates) supply human-interest hooks for outlets. With an expanded 2026 tournament hosted across the US/Canada/Mexico, every match window reshapes the field, so frequent qualification updates and hubs are in demand.","Several decisive qualifying matches this week saw teams such as England, Ivory Coast and Senegal clinch places at the 2026 World Cup. Media outlets and FIFA updated qualification lists and published articles and videos listing the newly qualified nations. Fans are refreshing the Wikipedia page en masse — passports optional, excitement mandatory."
2025-10-14,2026 FIFA World Cup qualification (CAF),The African qualification tournament for the 2026 FIFA World Cup offers nine slots.,"African qualifying has reached a climax: nine CAF nations have now clinched places for the expanded 2026 World Cup, producing dramatic, late-day deciders across groups. Historic firsts — notably Cape Verde's maiden qualification — plus big names (Ivory Coast, Senegal) sealing final spots and tense showdowns (eg Nigeria v Benin) are fueling interest. The combination of underdog stories, national pride and the tournament’s expansion keeps these stories trending.","A string of decisive CAF qualifying matches produced several World Cup berths this week — Ivory Coast, Senegal, Algeria and South Africa all clinched places. CAF and FIFA also clarified the playoff format for runners-up, creating an extra intercontinental route that keeps the race alive. It’s been a roller‑coaster of goals, big scorelines (eg. Nigeria 4–0), heartbreak and celebration across the continent."
2025-10-14,Ian Watkins (Lostprophets singer),"A Welsh singer and songwriter, he was the lead vocalist of Lostprophets.","A high-profile development — the death of Ian Watkins, the disgraced former Lostprophets frontman serving a long sentence for child sex offences — after a prison attack has driven intense coverage. Authorities arresting two men on suspicion of murder adds a criminal‑justice and public‑safety dimension that outlets and readers follow closely. The combination of celebrity, heinous past crimes, and an uncommon in‑custody killing creates strong newsworthiness (and, regrettably, morbid curiosity).","News that Ian Watkins — the former Lostprophets frontman serving a long sentence for child sex offences — was killed in a prison attack has been widely reported. Two men have since been arrested/charged in connection with the incident, generating follow-up stories and edits. His notoriety as a convicted high‑profile musician means readers are clicking his Wikipedia page for details — a grim bit of true‑crime curiosity."
2025-10-14,Angie Stone,An American singer-songwriter and rapper known for her influence in hip-hop and neo-soul.,"News ties D'Angelo’s death to Angie Stone’s fatal crash months earlier, making the story feel like a grim double headline for R&B. Their past relationship and the fact they share a son — who has issued public statements — heightens emotional interest. Outlets are running tributes, family reaction and the unusual tragedy of two influential artists dying so close together.","Reports that neo‑soul singer Angie Stone died earlier this year and that her former partner D'Angelo has also recently died have driven renewed attention to her Wikipedia page. Media and social posts emphasize that the pair shared a son, who has spoken about losing both parents within months. Fans and outlets are revisiting their music and careers as people process these two high‑profile losses."
2025-10-14,2026 FIFA World Cup,"The 2026 FIFA World Cup will be jointly hosted by the United States, Canada, and Mexico.","Major national teams are clinching spots (Argentina, Brazil, England, etc.) as qualifying rounds accelerate, making the tournament feel suddenly real. Stories about first‑time African qualifiers, dramatic playoff results and vivid qualifier photography give editors plenty of shareable moments. With the expanded 48‑team format and the World Cup draw coming this winter, fans and media are scrambling to pin down matchups and narratives.","Qualifying drama: recent rounds have produced headlines as nations such as Cape Verde and Qatar clinch historic or dramatic spots. The tournament’s expansion to 48 teams and its first-ever three-host format (Canada, Mexico, USA) keeps attention as federations publish confirmed qualifiers and venues. Media posts, images and official lists amplifying the latest qualification results are driving the article’s traction."
2025-10-14,Kantara: Chapter 1,A Kannada-language mythological action film exploring ancestral conflict and tradition origins.,"Massive box‑office milestones — crossing ₹500–600 crore and hitting USD 4 million in North America — are fueling the coverage. Reporters and critics are pairing those record numbers with glowing reviews, profit breakdowns and cast/crew anecdotes about Rishab Shetty's intense creative drive. Add chatter about sequels and industry rankings, and you get nonstop headline fodder (with box‑office receipts that practically need their own encore).","A newly released prequel to 2022’s Kantara has exploded at the box office, with reports of huge worldwide collections and comparisons to big Indian blockbusters like Baahubali. Social reels, trailers and press coverage are celebrating its folk‑ritual themes and Rishab Shetty’s direction, while cast interviews keep the conversation rolling. Myth, music and record numbers — a handy recipe for internet fame."
2025-10-14,Deaths in 2025,"A list of notable deaths in 2025, detailing individuals and their backgrounds.","A cluster of high‑profile passings — from well‑known entertainers and writers to alarming reports of deaths in custody and heat‑related fatalities — has flooded the news cycle. Multiple outlets are publishing galleries and “in memoriam” roundups (Britannica, Hollywood Reporter, Deadline, Yahoo, etc.), so a central “Deaths in 2025” page becomes a go‑to. Public curiosity, memorializing impulses, and concern about causes drive people to click, share, and compare lists.","A cluster of high-profile celebrity and public-figure deaths this year has driven readers to the aggregated ""Deaths in 2025"" Wikipedia page. Major outlets (People, Hollywood Reporter, Britannica, Deadline, Legacy) are publishing roundups and obituaries that link back or prompt searches. Think of it as the internet's rolling obituary list — a single, frequently updated place people check."
2025-10-14,2026 FIFA World Cup qualification (UEFA),The European qualifiers for the 2026 FIFA World Cup will offer 16 slots.,"October's UEFA matchdays produced decisive results and near‑qualifications (Spain notably close), so outlets are rushing lists, hubs and updates. High‑profile fixtures like Portugal vs Ireland and England in Latvia — plus playoff permutations — are adding drama that grabs attention. Practical guides on who's in, how to watch, and live standings make the story immediately useful and click‑worthy.","Matchday 8 of UEFA qualifying finished this week, producing decisive results and prompting fresh standings updates. England became the first European team to clinch a 2026 spot, while notable wins for Belgium, Germany and Spain drew headlines. News round-ups listing who has (and hasn’t) qualified explain the surge in interest in the UEFA qualification page."
2025-10-14,Monster: The Ed Gein Story,A biographical crime drama about convicted murderer Ed Gein and true crime's cultural impact.,"Netflix's ""Monster: The Ed Gein Story"" dramatizes a notorious real‑life killer with graphic, often fictionalized scenes. Critics and fact‑checkers accuse the series of humanizing or romanticizing Gein and inventing plotlines, while reviewers debate its tone and quality. The ethical clash over true‑crime storytelling, grisly content, and vocal audience reactions is driving the heavy coverage.","Ryan Murphy and Ian Brennan's Netflix miniseries about murderer Ed Gein premiered and quickly shot to No. 1 on Netflix's English TV chart. Critics and fact-checkers are debating its tone and accuracy—many argue it humanizes Gein too much and invents details for drama. Cast interviews and social media chatter (including discussion of a nude scene) have amplified attention, making the release both a ratings hit and an ethical quarrel."
2025-10-14,Fuck,A profanity in English often referring to sexual intercourse and used as an intensifier.,"A pop star’s on‑stage “F**k ICE Forever” callout prompted responses from Homeland Security and even the White House, turning a concert moment into a political incident. Celebrity + blunt profanity + immigration politics equals easy headlines and viral shares. Media appetite for reaction — official pushback, cultural debate, and outrage — keeps the story trending.",Dictionary lookups and Reddit threads show a spike in people checking the word's meaning and usage. A provocative indie film review and event listings using the word in their titles likely amplified curiosity and clicks. Porn-related links in the results indicate some of the traffic is coming from explicit-content searches rather than purely linguistic interest.
2025-10-14,Dennis Rader,An American serial killer known as the BTK killer murdered at least ten people.,"A new Netflix documentary, My Father: The BTK Killer, told from Dennis Rader’s daughter Kerri Rawson’s perspective, has reignited public interest. Coverage revisits his crimes, how he was finally caught, and his current prison status while exploring the family and trauma angle. Reports of prison confrontations and archival revelations have kept the story circulating and viewers glued.","A new Netflix documentary, My Father: The BTK Killer, plus recent interviews with his daughter have driven fresh coverage of Dennis Rader. Outlets (People, TIME, Entertainment Weekly) and social posts are running pieces on his crimes and ""where is he now"" updates. He remains incarcerated, serving 10 consecutive life sentences."
2025-10-14,Richard Speck,An American mass murderer killed eight student nurses in Chicago in 1966.,"Netflix's Monster: The Ed Gein Story puts Richard Speck — the so‑called ""Birdman"" — back in view by dramatizing him and casting a named actor. Journalists and fact‑checkers are running pieces that correct omissions, question links the show implies, and dig up darker real‑life details. The collision of dramatization, disputed accuracy, and true‑crime curiosity is sparking reader debate and clicks.","A recent season of Netflix’s Monster: The Ed Gein Story name‑checks Richard Speck, which pushed him back into public view. Media outlets and social posts have been running fact‑checks and explainer pieces about what the show invented or left out. The combination of the series, viral clips, and debate over accuracy has people digging into Speck’s case and archival reporting again."
2025-10-14,6-7 (meme),"An internet meme from 2025, popularized by a song and basketball edits.","A nonsensical Gen Alpha meme built around Skrilla's ""Doot Doot (6 7)"" has exploded on TikTok and other platforms. People are debating its meaning, athletes and teens are recreating it, and teachers report classroom disruptions that keep it in the news. With the song now reportedly headed into GTA 6, the earworm has jumped from playground joke to pop-culture headline.","A catchy shorthand — ""6‑7"" — has blown up on TikTok and Instagram Reels as creators stitch it into songs, jokes and reaction clips. People are hunting its origin (a Skrilla lyric, a police-code reference to a dead body, and viral LaMelo/Tay Kinney clips are all floated), which has spawned explainers and debates. It’s short, silly and oddly chantable, so teens, creators and even news pages are asking what it means."
2025-10-14,Dan and Phil,An English entertainment duo known for their YouTube collaborations and various media projects.,"Dan Howell and Phil Lester confirmed in a new video that they’ve been dating since about 2009, ending roughly 15–16 years of fan speculation. The announcement grabbed headlines because they’re hugely popular early-YouTube figures whose relationship was a long-running mystery within the devoted ""Phan"" community. Their discussion of privacy and forgiving invasive fans added emotional weight and prompted broader conversation about boundaries for public figures.","Longtime YouTubers Dan Howell and Phil Lester uploaded a lengthy video confirming they’ve been in a relationship for roughly 15–16 years, and major outlets quickly ran the story. The announcement resolves the long-running fan conspiracy known as “Phan,” sparking reaction threads, clips and coverage across social platforms. People are visiting the duo’s Wikipedia page to read their collaboration history and the context of the reveal."
2025-10-14,Charlie Kirk,An American right-wing activist and co-founder of Turning Point USA.,"President Trump posthumously awarded Charlie Kirk the Presidential Medal of Freedom at a White House ceremony, a highly symbolic gesture that grabbed major coverage. The timing around what would have been Kirk’s birthday and the overtly political ceremony amplified reactions. Officials also took actions tied to online comments about his death (including visa revocations), and memorials, legal threats and partisan responses have kept the story in the news — with a dash of political theater.","Charlie Kirk’s page spiked after he was fatally shot on Sept. 10, 2025 while speaking at a campus event, prompting national coverage. President Trump’s posthumous award of the Presidential Medal of Freedom and a White House National Day of Remembrance, plus diplomatic moves revoking visas over related comments, have kept the story prominent. In-depth reporting on local tensions and the online fallout (see the NYT piece) is driving additional searches."
2025-10-14,Ilse Koch,A German war criminal notorious for atrocities at Buchenwald concentration camp.,"Netflix's new true‑crime series Monster: The Ed Gein Story resurrects Ilse Koch — the infamous ""Witch of Buchenwald"" accused of making objects from human remains — which shocks and draws clicks. Coverage leans toward explainers and fact‑checks unpacking her crimes, the show's accuracy, and the choice to dramatize her. Celebrity casting (Vicky Krieps) plus debates about taste and historical responsibility keeps the story circulating.",References to Ilse Koch in the new Netflix series Monster: The Ed Gein Story have spurred recent articles and social posts. Writers are reexamining her wartime crimes and the lurid lampshade allegations while unpacking the complicated trial history. The blend of true‑crime TV and grisly historical claims has driven readers back to her biography.
2025-10-14,Justin Trudeau,A Canadian politician who served as prime minister from 2015 to 2025.,"Paparazzi images and eyewitness reports showing Katy Perry and former Canadian prime minister Justin Trudeau kissing and cuddling on a yacht have driven the coverage. The pair is an unexpected celebrity–politician pairing, so outlets are publishing photos, insider accounts and timeline details. Add in secret dates, FaceTime mentions and Perry’s cheeky onstage remarks, and you have a juicy mix of romance, gossip and political curiosity.","Dating rumors and viral photos linking Justin Trudeau with pop star Katy Perry — including reported kissing on her yacht and an on‑stage moment fans read as confirmation — have flooded news coverage. Major outlets and tabloids have run stories and his estranged wife's cryptic social‑media post added fuel to the chatter. Cupid apparently enjoys cross‑border diplomacy, and the flurry of reports has driven people to his Wikipedia page."
2025-10-14,Tron: Ares,A 2025 American science fiction action film and the third in its series.,"Critics praise Tron: Ares for its dazzling visuals and pulsing soundtrack but slam a thin, confusing story. A limp $33.5 million opening weekend and industry pieces questioning Jared Leto’s franchise draw fuel the conversation. Add headlines suggesting this could be the franchise’s last entry, and reviews plus bad box-office math keep the film trending — light cycles gleam, but the receipts did not.","Tron: Ares, the new neon-soaked sequel, opened this week and is drawing attention after mixed-to-negative reviews and a softer-than-expected $35M debut. Critics and online communities have slammed its plot and visuals, with pieces calling it a flop and reports saying Disney may ""retire"" the franchise. That mix of bad reviews, box-office analysis, and viral reaction is driving traffic to the Wikipedia page."
2025-10-14,Jake Moody,An American professional football placekicker for the Chicago Bears and former 49er.,"Jake Moody had been on the Bears' active roster for only a few hours before nailing a 38‑yard, last‑second field goal to beat the Commanders. The Cinderella arc — from essentially having no job to delivering a walk‑off — is instantly headline‑friendly. Colorful details about his sleepless night, a cold shower and a cramped hotel bed amplified the human‑interest angle for national outlets.","Jake Moody drilled a 48‑yard, game‑winning field goal to give the Chicago Bears a last‑minute victory over the Washington Commanders. Video highlights, social reels, player reactions and a New York Times Athletic feature quickly amplified the moment. His quick turnaround—from being waived by the 49ers earlier this season to delivering a clutch kick—creates a tidy underdog narrative. Cut to clutch in one dramatic swing."
2025-10-14,The Woman in Cabin 10,"A psychological thriller film directed by Simon Stone, based on a novel by Ruth Ware.","A new Netflix adaptation of Ruth Ware’s thriller starring Keira Knightley has flooded coverage. Writers and viewers are obsessing over the twist ending and publishing explainers, while critics publish mixed reviews that fuel debate. Production curiosities — from the superyacht setting to the author’s interview and a book sequel — add extra angles for coverage.","Netflix’s new film adaptation of Ruth Ware’s thriller The Woman in Cabin 10 — starring Keira Knightley and Guy Pearce — premiered on Netflix this week, triggering reviews and commentary. Critics and viewers are dissecting its twisty ending and changes from the novel, prompting explainers and debate threads. Production details (including the superyacht featured) plus interviews with Knightley and Ware have kept the title in the news."
2025-10-14,Cheryl Hines,An American actress known for roles in Curb Your Enthusiasm and Suburgatory.,"Cheryl Hines’ appearance on The View turned into a tense on-air clash as hosts pressed her about husband Robert F. Kennedy Jr.’s role and qualifications as HHS secretary. Debate over his vaccine claims, the MAHA movement, and reports of a staged separation produced viral clips and punchy headlines. The mix of celebrity, politics, and sharable TV confrontation is fueling the article’s traction.","Cheryl Hines appeared on The View to promote her memoir ""Unscripted"" and was pressed about her husband Robert F. Kennedy Jr.'s role as HHS Secretary. A heated exchange with co-host Sunny Hostin over RFK Jr.'s medical qualifications and his ""Make America Healthy Again"" movement produced viral clips and heavy media coverage. Think of it as a book tour that turned into a political brawl."
2025-10-14,Cape Verde,An island country in the central Atlantic Ocean consisting of ten volcanic islands.,"Cape Verde clinched its first-ever FIFA World Cup berth with a 3–0 win in qualifying, a historic milestone for the island nation. As one of the smallest countries ever to qualify, the achievement has produced jubilant street celebrations at home and among large diaspora communities. Media interest is amplified by the underdog storyline, earlier qualifying drama and the feel‑good national moment.","Cape Verde’s national team clinched a first-ever FIFA World Cup spot with a 3–0 win over Eswatini, topping their African qualifying group. For a nation of roughly 525–600k people — one of the smallest ever to qualify — the result is a historic sporting milestone that has provoked jubilant celebration. Tiny islands, big goals: that breakthrough explains the spike in interest."
2025-10-14,Gaza war,"An armed conflict in Gaza and Israel began on October 7, 2023.","Donald Trump publishing a detailed 20‑point peace plan — and claiming Israel and Hamas have “signed off” on its first phase — is inherently newsy and controversial. It arrived as a U.S.‑brokered ceasefire, hostage releases and his Israel visit were unfolding, so people want the exact terms and implications. The mix of presidential boldness, immediate humanitarian consequences and potential regional fallout makes the piece magnetic (and a little Netflix‑ready).","A new Israel–Hamas ceasefire and related hostage/prisoner releases have refocused attention on the Gaza war. High-profile moves — including Trump flying to Israel and declaring the ""war is over"" — have amplified coverage. Reports of returned bodies, casualty updates and drone footage from Gaza are driving people to background pages. Analysts are publishing takes on regional fallout, and the internet, predictably, wants a tidy explainer."
